{
  "$schema": "https://json-schema.org/draft/2020-12/schema",
  "$id": "vouch.transcription-complexity-metrics.schema.v0",
  "type": "object",
  "required": [
    "transcription_complexity_metrics",
    "version",
    "generator",
    "source_manifests",
    "entries",
    "summary",
    "boundary"
  ],
  "properties": {
    "transcription_complexity_metrics": {
      "const": "vouch.transcription-complexity-metrics/v0"
    },
    "version": {
      "type": "string"
    },
    "generator": {
      "type": "object"
    },
    "source_manifests": {
      "type": "array"
    },
    "entries": {
      "type": "array"
    },
    "summary": {
      "type": "object"
    },
    "boundary": {
      "type": "object"
    }
  },
  "additionalProperties": false
}
