{
  "transcription_complexity_metrics": "vouch.transcription-complexity-metrics/v0",
  "version": "1.3.11",
  "generator": {
    "script": "scripts/check-transcription-complexity-metrics.mjs",
    "mode": "m2-static-complexity-metrics",
    "inputs": [
      "manifests/jsonlogic-shallow-oracle.v0.json",
      "manifests/cedar-shallow-oracle.v0.json",
      "manifests/openfisca-core-deep-oracle.v0.json"
    ]
  },
  "source_manifests": [
    {
      "path": "manifests/jsonlogic-shallow-oracle.v0.json",
      "sha256": "4c1e11bddd6b512bb9d1d44d6cb7ae2205ce5994d18869570aa1396377deb16c",
      "rule_count": 2,
      "case_count": 68
    },
    {
      "path": "manifests/cedar-shallow-oracle.v0.json",
      "sha256": "ed6013fca6355516f02418ee7bf256313a0fa5436aafd8e31cef8b137cc11136",
      "rule_count": 2,
      "case_count": 64
    },
    {
      "path": "manifests/openfisca-core-deep-oracle.v0.json",
      "sha256": "a40fd773b434461276c5fe398b5215ff94118c025a5f5a49fa4bec5050f95dff",
      "rule_count": 1,
      "case_count": 544
    }
  ],
  "entries": [
    {
      "source_manifest_path": "manifests/jsonlogic-shallow-oracle.v0.json",
      "rule_id": "jsonlogic-pie-ready",
      "source_system": "JSON Logic",
      "oracle_strength": "documented-example-compatible-local-evaluator",
      "case_count": 64,
      "source_files": {
        "lispex": {
          "path": "profile-gallery/decision-gallery/cases/jsonlogic-pie-ready.lspx",
          "sha256": "b5a5a21e387abcc9538cf2be8fa313a26939fd86e567bcbe0cf831815cd90c7a"
        },
        "upstream": {
          "path": "transcription/jsonlogic-shallow/rules/pie-ready.json",
          "sha256": "0c0ed84fa18e371c65c31894c07f3ec9acc218cd43987d6f9bcb175f17b3ad62"
        }
      },
      "metrics": {
        "lispex_non_empty_loc": 4,
        "upstream_non_empty_loc": 31,
        "input_leaf_count": 2,
        "if_count": 1,
        "max_list_depth": 5,
        "band_identifier_count": 0,
        "lookup_token_count": 0,
        "arithmetic_token_count": 0,
        "comparison_token_count": 2,
        "invalid_input_classes": []
      }
    },
    {
      "source_manifest_path": "manifests/jsonlogic-shallow-oracle.v0.json",
      "rule_id": "jsonlogic-required-fields",
      "source_system": "JSON Logic",
      "oracle_strength": "documented-example-compatible-local-evaluator",
      "case_count": 4,
      "source_files": {
        "lispex": {
          "path": "profile-gallery/decision-gallery/cases/jsonlogic-required-fields.lspx",
          "sha256": "986cf8c1846a2c5d5628089a637dd123505006c2ca20b8f8ae696a1e72715fa1"
        },
        "upstream": {
          "path": "transcription/jsonlogic-shallow/rules/required-fields.json",
          "sha256": "60f95b46d4eedc10f4257ca2b6564ae5275f4398bda17d58eeba0642d5755048"
        }
      },
      "metrics": {
        "lispex_non_empty_loc": 3,
        "upstream_non_empty_loc": 21,
        "input_leaf_count": 2,
        "if_count": 1,
        "max_list_depth": 4,
        "band_identifier_count": 0,
        "lookup_token_count": 0,
        "arithmetic_token_count": 0,
        "comparison_token_count": 0,
        "invalid_input_classes": [
          "missing-required-field"
        ]
      }
    },
    {
      "source_manifest_path": "manifests/cedar-shallow-oracle.v0.json",
      "rule_id": "cedar-specific-photo",
      "source_system": "Cedar",
      "oracle_strength": "documented-example-compatible-local-evaluator",
      "case_count": 32,
      "source_files": {
        "lispex": {
          "path": "transcription/cedar-shallow/lispex/specific-photo.lspx",
          "sha256": "e5f99e7cdc633ec6c526c27aacd55016de00a94a09bca67939e8dacd2ec565f9"
        },
        "upstream": {
          "path": "transcription/cedar-shallow/policies/specific-photo.cedar",
          "sha256": "500a4d652df19c803bf42731113d6a73151a440def8d3b511ea6e8288a35f980"
        }
      },
      "metrics": {
        "lispex_non_empty_loc": 5,
        "upstream_non_empty_loc": 5,
        "input_leaf_count": 4,
        "if_count": 1,
        "max_list_depth": 7,
        "band_identifier_count": 0,
        "lookup_token_count": 0,
        "arithmetic_token_count": 0,
        "comparison_token_count": 3,
        "invalid_input_classes": []
      }
    },
    {
      "source_manifest_path": "manifests/cedar-shallow-oracle.v0.json",
      "rule_id": "cedar-owner-or-public-photo",
      "source_system": "Cedar",
      "oracle_strength": "documented-example-compatible-local-evaluator",
      "case_count": 32,
      "source_files": {
        "lispex": {
          "path": "transcription/cedar-shallow/lispex/owner-or-public-photo.lspx",
          "sha256": "247bd8e123c18498e00737f1ce54c51ad0b208a460670638de2fe35edd3bde30"
        },
        "upstream": {
          "path": "transcription/cedar-shallow/policies/owner-or-public-photo.cedar",
          "sha256": "98b0ed427dfe53f5e77167de53df45df2050bf9daee26c624846d0d78af3d764"
        }
      },
      "metrics": {
        "lispex_non_empty_loc": 6,
        "upstream_non_empty_loc": 7,
        "input_leaf_count": 5,
        "if_count": 1,
        "max_list_depth": 10,
        "band_identifier_count": 0,
        "lookup_token_count": 0,
        "arithmetic_token_count": 0,
        "comparison_token_count": 3,
        "invalid_input_classes": []
      }
    },
    {
      "source_manifest_path": "manifests/openfisca-core-deep-oracle.v0.json",
      "rule_id": "openfisca-core-benefit-taper",
      "source_system": "OpenFisca Core",
      "oracle_strength": "executable-engine",
      "case_count": 544,
      "source_files": {
        "lispex": {
          "path": "transcription/openfisca-core-deep/lispex/benefit-taper.lspx",
          "sha256": "25c7b19e7b897319853f4d8c161d38d1dcc7736c229bdd4b97fc85c08240ffc1"
        },
        "upstream": {
          "path": "transcription/openfisca-core-deep/openfisca/benefit_taper_model.py",
          "sha256": "592397af2413f169cf2a9539617ee0e4c2269184f7012b0d309d7d45a57e1285"
        }
      },
      "metrics": {
        "lispex_non_empty_loc": 25,
        "upstream_non_empty_loc": 122,
        "input_leaf_count": 4,
        "if_count": 3,
        "max_list_depth": 6,
        "band_identifier_count": 2,
        "lookup_token_count": 0,
        "arithmetic_token_count": 14,
        "comparison_token_count": 3,
        "invalid_input_classes": [
          "bad-input"
        ]
      }
    }
  ],
  "summary": {
    "rule_count": 5,
    "case_count": 676,
    "lispex_non_empty_loc": 43,
    "upstream_non_empty_loc": 186,
    "input_leaf_count_max": 5,
    "if_count": 7,
    "band_identifier_count": 2,
    "lookup_token_count": 0,
    "arithmetic_token_count": 14,
    "comparison_token_count": 11,
    "invalid_input_class_count": 2,
    "source_system_rule_counts": {
      "JSON Logic": 2,
      "Cedar": 2,
      "OpenFisca Core": 1
    },
    "invalid_input_classes": [
      "bad-input",
      "missing-required-field"
    ]
  },
  "boundary": {
    "attests": [
      "m2-static-complexity-metrics",
      "source-file-hash-pinning",
      "rule-case-count-accounting",
      "invalid-input-class-accounting"
    ],
    "excludes": [
      "semantic-complexity-proof",
      "maintainability-claim",
      "policy-correctness",
      "semantic-equivalence",
      "full-upstream-language-coverage",
      "external-independent-verification",
      "receipt-authenticity"
    ]
  }
}
